{
  "$schema": "https://json-schema.org/draft/2020-12/schema",
  "title": "Pipeline data",
  "type": "object",
  "required": ["version", "generated_at", "scan_window_start", "stages", "applications", "contacts", "messages", "events", "stats"],
  "additionalProperties": false,
  "$defs": {
    "ts": {"type": "string", "pattern": "^\\d{4}-\\d{2}-\\d{2}T\\d{2}:\\d{2}:\\d{2}Z$"},
    "date": {"type": "string", "pattern": "^\\d{4}-\\d{2}-\\d{2}$"},
    "stage_id": {"type": "string", "enum": ["applied", "recruiter_screen", "hiring_manager", "technical", "onsite", "offer", "accepted", "rejected", "withdrew", "ghosted"]},
    "party": {"type": "object", "required": ["name", "email"], "additionalProperties": false,
              "properties": {"name": {"type": "string"}, "email": {"type": "string"}}}
  },
  "properties": {
    "version": {"const": 1},
    "generated_at": {"$ref": "#/$defs/ts"},
    "scan_window_start": {"$ref": "#/$defs/date"},
    "stages": {
      "type": "array", "minItems": 10, "maxItems": 10,
      "items": {"type": "object", "required": ["id", "label", "kind"], "additionalProperties": false,
                "properties": {"id": {"$ref": "#/$defs/stage_id"}, "label": {"type": "string"},
                               "kind": {"enum": ["active", "terminal"]}}}
    },
    "applications": {
      "type": "array",
      "items": {
        "type": "object",
        "required": ["id", "company", "role", "source", "applied_at", "current_stage", "terminal", "stage_history",
                     "contact_ids", "message_ids", "event_ids", "description", "notes", "last_activity_at", "origin"],
        "additionalProperties": false,
        "properties": {
          "id": {"type": "string", "pattern": "^app_[0-9a-f]{6}$"},
          "company": {"type": "string", "minLength": 1},
          "role": {"type": "string"},
          "source": {"enum": ["linkedin", "indeed", "greenhouse", "lever", "workday", "ashby", "icims", "smartrecruiters", "recruiter", "company_site", "manual", "other"]},
          "applied_at": {"$ref": "#/$defs/date"},
          "current_stage": {"$ref": "#/$defs/stage_id"},
          "terminal": {"type": "boolean"},
          "stage_history": {
            "type": "array", "minItems": 1,
            "items": {"type": "object", "required": ["stage", "at", "message_id", "evidence"], "additionalProperties": false,
                      "properties": {"stage": {"$ref": "#/$defs/stage_id"}, "at": {"$ref": "#/$defs/ts"},
                                     "message_id": {"type": ["string", "null"]},
                                     "evidence": {"type": "string"}}}
          },
          "contact_ids": {"type": "array", "items": {"type": "string"}},
          "message_ids": {"type": "array", "items": {"type": "string"}},
          "event_ids": {"type": "array", "items": {"type": "string"}},
          "description": {
            "oneOf": [
              {"type": "null"},
              {"type": "object", "required": ["url", "text", "source", "fetched_at"], "additionalProperties": false,
               "properties": {"url": {"type": ["string", "null"]}, "text": {"type": "string"},
                              "source": {"enum": ["greenhouse", "lever", "ashby", "workday", "jsonld", "page", "manual"]},
                              "fetched_at": {"$ref": "#/$defs/ts"}}}
            ]
          },
          "notes": {"type": "string"},
          "last_activity_at": {"$ref": "#/$defs/ts"},
          "origin": {"enum": ["email", "manual"]}
        }
      }
    },
    "contacts": {
      "type": "array",
      "items": {"type": "object",
                "required": ["id", "name", "email", "title", "company", "first_seen", "last_seen", "message_count", "application_ids"],
                "additionalProperties": false,
                "properties": {"id": {"type": "string", "pattern": "^c_"}, "name": {"type": "string"}, "email": {"type": "string"},
                               "title": {"type": "string"}, "company": {"type": "string"},
                               "first_seen": {"$ref": "#/$defs/ts"}, "last_seen": {"$ref": "#/$defs/ts"},
                               "message_count": {"type": "integer", "minimum": 0},
                               "application_ids": {"type": "array", "items": {"type": "string"}}}}
    },
    "messages": {
      "type": "array",
      "items": {"type": "object",
                "required": ["id", "thread_id", "date", "direction", "from", "to", "subject", "snippet", "body", "gmail_url", "stage_signal", "labels"],
                "additionalProperties": false,
                "properties": {"id": {"type": "string", "pattern": "^m_"}, "thread_id": {"type": "string", "pattern": "^t_"},
                               "date": {"$ref": "#/$defs/ts"}, "direction": {"enum": ["in", "out"]},
                               "from": {"$ref": "#/$defs/party"}, "to": {"type": "array", "items": {"$ref": "#/$defs/party"}},
                               "subject": {"type": "string"}, "snippet": {"type": "string", "maxLength": 300},
                               "body": {"type": "string", "maxLength": 20000}, "gmail_url": {"type": "string"},
                               "stage_signal": {"oneOf": [{"type": "null"}, {"$ref": "#/$defs/stage_id"}]},
                               "labels": {"type": "array", "items": {"type": "string"}}}}
    },
    "events": {
      "type": "array",
      "items": {"type": "object",
                "required": ["id", "application_id", "at", "end_at", "title", "attendees", "stage", "message_id"],
                "additionalProperties": false,
                "properties": {"id": {"type": "string", "pattern": "^e_"}, "application_id": {"type": "string"},
                               "at": {"$ref": "#/$defs/ts"}, "end_at": {"oneOf": [{"type": "null"}, {"$ref": "#/$defs/ts"}]},
                               "title": {"type": "string"}, "attendees": {"type": "array", "items": {"$ref": "#/$defs/party"}},
                               "stage": {"oneOf": [{"type": "null"}, {"$ref": "#/$defs/stage_id"}]},
                               "message_id": {"type": ["string", "null"]}}}
    },
    "stats": {"type": "object", "required": ["applications", "active", "offers", "rejected", "ghosted", "response_rate"],
              "additionalProperties": false,
              "properties": {"applications": {"type": "integer"}, "active": {"type": "integer"}, "offers": {"type": "integer"},
                             "rejected": {"type": "integer"}, "ghosted": {"type": "integer"},
                             "response_rate": {"type": "number", "minimum": 0, "maximum": 1}}}
  }
}
