{
 "version": 1,
 "generated_at": "2026-10-14T18:00:00Z",
 "scan_window_start": "2026-10-01",
 "stages": [
  {
   "id": "applied",
   "label": "Applied",
   "kind": "active"
  },
  {
   "id": "recruiter_screen",
   "label": "Recruiter screen",
   "kind": "active"
  },
  {
   "id": "hiring_manager",
   "label": "Hiring manager",
   "kind": "active"
  },
  {
   "id": "technical",
   "label": "Technical",
   "kind": "active"
  },
  {
   "id": "onsite",
   "label": "Onsite / panel",
   "kind": "active"
  },
  {
   "id": "offer",
   "label": "Offer",
   "kind": "active"
  },
  {
   "id": "accepted",
   "label": "Accepted",
   "kind": "terminal"
  },
  {
   "id": "rejected",
   "label": "Rejected",
   "kind": "terminal"
  },
  {
   "id": "withdrew",
   "label": "Withdrew",
   "kind": "terminal"
  },
  {
   "id": "ghosted",
   "label": "Ghosted",
   "kind": "terminal"
  }
 ],
 "applications": [
  {
   "id": "app_3d3c93",
   "company": "Oakmont Insurance",
   "role": "BI Engineer",
   "source": "ashby",
   "applied_at": "2026-10-09",
   "current_stage": "rejected",
   "terminal": true,
   "stage_history": [
    {
     "stage": "applied",
     "at": "2026-10-09T14:35:00Z",
     "message_id": "m_7622db72",
     "evidence": "confirmation"
    },
    {
     "stage": "rejected",
     "at": "2026-10-14T14:35:00Z",
     "message_id": "m_c2dcbade",
     "evidence": "email"
    }
   ],
   "contact_ids": [],
   "message_ids": [
    "m_7622db72",
    "m_cb52acec",
    "m_c2dcbade"
   ],
   "event_ids": [],
   "description": null,
   "notes": "",
   "last_activity_at": "2026-10-14T14:35:00Z",
   "origin": "email"
  },
  {
   "id": "app_0ae239",
   "company": "Umbra Security",
   "role": "Data Engineering Manager",
   "source": "linkedin",
   "applied_at": "2026-10-10",
   "current_stage": "technical",
   "terminal": false,
   "stage_history": [
    {
     "stage": "applied",
     "at": "2026-10-10T12:45:00Z",
     "message_id": "m_59ae7d9a",
     "evidence": "confirmation"
    },
    {
     "stage": "recruiter_screen",
     "at": "2026-10-11T12:45:00Z",
     "message_id": "m_5630fb2a",
     "evidence": "email"
    },
    {
     "stage": "technical",
     "at": "2026-10-14T12:45:00Z",
     "message_id": "m_0e95ef57",
     "evidence": "calendar_invite"
    }
   ],
   "contact_ids": [
    "c_411eb5cb"
   ],
   "message_ids": [
    "m_59ae7d9a",
    "m_5630fb2a",
    "m_0e95ef57",
    "m_9541b806"
   ],
   "event_ids": [
    "e_04"
   ],
   "description": null,
   "notes": "",
   "last_activity_at": "2026-10-14T13:45:00Z",
   "origin": "email"
  },
  {
   "id": "app_a7da8e",
   "company": "Glasshouse Retail",
   "role": "Senior Data Engineer",
   "source": "smartrecruiters",
   "applied_at": "2026-10-08",
   "current_stage": "rejected",
   "terminal": true,
   "stage_history": [
    {
     "stage": "applied",
     "at": "2026-10-08T15:00:00Z",
     "message_id": "m_1219e3d5",
     "evidence": "confirmation"
    },
    {
     "stage": "rejected",
     "at": "2026-10-13T15:00:00Z",
     "message_id": "m_d1e4750d",
     "evidence": "email"
    }
   ],
   "contact_ids": [],
   "message_ids": [
    "m_1219e3d5",
    "m_150a1c74",
    "m_d1e4750d"
   ],
   "event_ids": [],
   "description": null,
   "notes": "",
   "last_activity_at": "2026-10-13T15:00:00Z",
   "origin": "email"
  },
  {
   "id": "app_64558d",
   "company": "Brightwater Labs",
   "role": "Lead Analytics Engineer",
   "source": "greenhouse",
   "applied_at": "2026-10-04",
   "current_stage": "rejected",
   "terminal": true,
   "stage_history": [
    {
     "stage": "applied",
     "at": "2026-10-04T15:00:00Z",
     "message_id": "m_195defb4",
     "evidence": "confirmation"
    },
    {
     "stage": "recruiter_screen",
     "at": "2026-10-06T15:00:00Z",
     "message_id": "m_80d823c7",
     "evidence": "email"
    },
    {
     "stage": "hiring_manager",
     "at": "2026-10-10T15:00:00Z",
     "message_id": "m_107a4bd2",
     "evidence": "email"
    },
    {
     "stage": "rejected",
     "at": "2026-10-13T15:00:00Z",
     "message_id": "m_c39d3057",
     "evidence": "email"
    }
   ],
   "contact_ids": [
    "c_428da0f6",
    "c_58e40337"
   ],
   "message_ids": [
    "m_195defb4",
    "m_80d823c7",
    "m_51976960",
    "m_107a4bd2",
    "m_c39d3057"
   ],
   "event_ids": [
    "e_01"
   ],
   "description": {
    "url": "https://boards.greenhouse.io/brightwaterlabs/jobs/4283583",
    "text": "Brightwater Labs is building the data foundation for a growing business, and the Lead Analytics Engineer will own how data moves from source systems into the warehouse.\n\nDay to day you will work with analysts and product managers to turn messy operational data into models people trust.\n\nThe team is small and remote friendly. We review each other's work, write things down, and prefer simple systems that stay up.",
    "source": "greenhouse",
    "fetched_at": "2026-10-04T15:05:00Z"
   },
   "notes": "",
   "last_activity_at": "2026-10-13T15:00:00Z",
   "origin": "email"
  },
  {
   "id": "app_ba2534",
   "company": "Alderbank",
   "role": "Principal Data Engineer",
   "source": "company_site",
   "applied_at": "2026-10-04",
   "current_stage": "rejected",
   "terminal": true,
   "stage_history": [
    {
     "stage": "applied",
     "at": "2026-10-04T13:50:00Z",
     "message_id": "m_4fbddda4",
     "evidence": "confirmation"
    },
    {
     "stage": "recruiter_screen",
     "at": "2026-10-05T13:50:00Z",
     "message_id": "m_19baed68",
     "evidence": "email"
    },
    {
     "stage": "technical",
     "at": "2026-10-08T13:50:00Z",
     "message_id": "m_879e61db",
     "evidence": "email"
    },
    {
     "stage": "rejected",
     "at": "2026-10-13T13:50:00Z",
     "message_id": "m_56222d53",
     "evidence": "email"
    }
   ],
   "contact_ids": [
    "c_b050543c"
   ],
   "message_ids": [
    "m_4fbddda4",
    "m_19baed68",
    "m_879e61db",
    "m_be88e757",
    "m_56222d53"
   ],
   "event_ids": [],
   "description": null,
   "notes": "",
   "last_activity_at": "2026-10-13T13:50:00Z",
   "origin": "email"
  },
  {
   "id": "app_6e98d3",
   "company": "Juniper Row",
   "role": "Data Engineering Manager",
   "source": "indeed",
   "applied_at": "2026-10-11",
   "current_stage": "applied",
   "terminal": false,
   "stage_history": [
    {
     "stage": "applied",
     "at": "2026-10-11T13:45:00Z",
     "message_id": "m_d729f73b",
     "evidence": "confirmation"
    }
   ],
   "contact_ids": [],
   "message_ids": [
    "m_d729f73b",
    "m_40f0fbb7",
    "m_6aee40e3"
   ],
   "event_ids": [],
   "description": null,
   "notes": "",
   "last_activity_at": "2026-10-13T13:45:00Z",
   "origin": "email"
  },
  {
   "id": "app_38f3cf",
   "company": "Quillfeather",
   "role": "Analytics Engineer",
   "source": "icims",
   "applied_at": "2026-10-09",
   "current_stage": "withdrew",
   "terminal": true,
   "stage_history": [
    {
     "stage": "applied",
     "at": "2026-10-09T12:45:00Z",
     "message_id": "m_677d7ef7",
     "evidence": "confirmation"
    },
    {
     "stage": "recruiter_screen",
     "at": "2026-10-10T12:45:00Z",
     "message_id": "m_c1acf4e0",
     "evidence": "email"
    },
    {
     "stage": "withdrew",
     "at": "2026-10-13T12:45:00Z",
     "message_id": "m_960875cb",
     "evidence": "email"
    }
   ],
   "contact_ids": [
    "c_3a0729cf"
   ],
   "message_ids": [
    "m_677d7ef7",
    "m_c1acf4e0",
    "m_719e21b0",
    "m_960875cb"
   ],
   "event_ids": [],
   "description": null,
   "notes": "",
   "last_activity_at": "2026-10-13T12:45:00Z",
   "origin": "email"
  },
  {
   "id": "app_6c6e41",
   "company": "Lanternworks",
   "role": "Analytics Engineer",
   "source": "linkedin",
   "applied_at": "2026-10-01",
   "current_stage": "rejected",
   "terminal": true,
   "stage_history": [
    {
     "stage": "applied",
     "at": "2026-10-01T13:10:00Z",
     "message_id": "m_96535e02",
     "evidence": "confirmation"
    },
    {
     "stage": "recruiter_screen",
     "at": "2026-10-02T13:10:00Z",
     "message_id": "m_8b82541e",
     "evidence": "email"
    },
    {
     "stage": "technical",
     "at": "2026-10-05T13:10:00Z",
     "message_id": "m_218e1615",
     "evidence": "email"
    },
    {
     "stage": "onsite",
     "at": "2026-10-09T13:10:00Z",
     "message_id": "m_f95aa307",
     "evidence": "email"
    },
    {
     "stage": "rejected",
     "at": "2026-10-12T13:10:00Z",
     "message_id": "m_42d9a9e7",
     "evidence": "email"
    }
   ],
   "contact_ids": [
    "c_7c46d339",
    "c_e2f1d271"
   ],
   "message_ids": [
    "m_96535e02",
    "m_8b82541e",
    "m_218e1615",
    "m_f95aa307",
    "m_42d9a9e7"
   ],
   "event_ids": [],
   "description": null,
   "notes": "",
   "last_activity_at": "2026-10-12T13:10:00Z",
   "origin": "email"
  },
  {
   "id": "app_7e4c76",
   "company": "Emberlight Health",
   "role": "Analytics Engineer",
   "source": "workday",
   "applied_at": "2026-10-07",
   "current_stage": "rejected",
   "terminal": true,
   "stage_history": [
    {
     "stage": "applied",
     "at": "2026-10-07T12:35:00Z",
     "message_id": "m_8f41db90",
     "evidence": "confirmation"
    },
    {
     "stage": "rejected",
     "at": "2026-10-12T12:35:00Z",
     "message_id": "m_53f3ed69",
     "evidence": "email"
    }
   ],
   "contact_ids": [],
   "message_ids": [
    "m_8f41db90",
    "m_aa6e0742",
    "m_53f3ed69"
   ],
   "event_ids": [],
   "description": null,
   "notes": "",
   "last_activity_at": "2026-10-12T12:35:00Z",
   "origin": "email"
  },
  {
   "id": "app_9636d8",
   "company": "Verdant Grid",
   "role": "Data Engineering Manager",
   "source": "linkedin",
   "applied_at": "2026-10-02",
   "current_stage": "accepted",
   "terminal": true,
   "stage_history": [
    {
     "stage": "applied",
     "at": "2026-10-02T12:30:00Z",
     "message_id": "m_1661ef70",
     "evidence": "confirmation"
    },
    {
     "stage": "recruiter_screen",
     "at": "2026-10-03T12:30:00Z",
     "message_id": "m_a2f61ac9",